{
  "schemaVersion": "1.0",
  "projectRoot": ".",
  "screenDocDir": "examples/screen-doc",
  "screenSpecDir": "examples/screens",
  "tokenDir": "examples/tokens",
  "catalogPath": "examples/catalogs/component-catalog.json",
  "buildDir": "build",
  "defaultPlatforms": [
    "ios",
    "android",
    "html"
  ]
}
